exp	description	val_bpb	peak_mem_gb	tok_sec	mfu	steps	status	notes	gpu_name	baseline_sha
exp0	baseline (no modifications)	1.075771	17.1	253333	28.3	1159	baseline	depth=10, NVIDIA RTX PRO 6000 Blackwell Server Edition	NVIDIA RTX PRO 6000 Blackwell Server Edition	81f26e347c9cb46d475e338008f4d6138a83bea3
exp1	Reduce DEVICE_BATCH_SIZE from default to 8 to increase gradient steps	0.000000	0.0	0	0.0	0	crash	training crashed or timed out	NVIDIA RTX PRO 6000 Blackwell Server Edition	81f26e347c9cb46d475e338008f4d6138a83bea3
exp2	Reduce TOTAL_BATCH_SIZE from default to 32768 to increase gradient steps	0.000000	0.0	0	0.0	0	crash	training crashed or timed out	NVIDIA RTX PRO 6000 Blackwell Server Edition	81f26e347c9cb46d475e338008f4d6138a83bea3
exp3	Increase DEPTH from default to 12 to better utilize available compute	1.095102	24.3	167666	30.0	768	discard	The baseline shows we have significant headroom with only 17.1GB memory usage ou	NVIDIA RTX PRO 6000 Blackwell Server Edition	81f26e347c9cb46d475e338008f4d6138a83bea3
exp4	Reduce TOTAL_BATCH_SIZE from default to 16384 to increase gradient steps	0.000000	0.0	0	0.0	0	crash	training crashed or timed out	NVIDIA RTX PRO 6000 Blackwell Server Edition	81f26e347c9cb46d475e338008f4d6138a83bea3
exp5	Reduce DEVICE_BATCH_SIZE from default to 16 to increase gradient steps	0.000000	0.0	0	0.0	0	crash	training crashed or timed out	NVIDIA RTX PRO 6000 Blackwell Server Edition	81f26e347c9cb46d475e338008f4d6138a83bea3
exp6	Increase MATRIX_LR from 0.04 to 0.05	1.078415	17.1	253164	28.3	1160	discard	Since reducing batch sizes has caused crashes, I'll try increasing the learning 	NVIDIA RTX PRO 6000 Blackwell Server Edition	81f26e347c9cb46d475e338008f4d6138a83bea3
