exp	description	val_bpb	peak_mem_gb	tok_sec	mfu	steps	status	notes	gpu_name	baseline_sha
exp0	baseline (no modifications)	1.077871	17.1	253248	28.3	1160	baseline	depth=10, NVIDIA RTX PRO 6000 Blackwell Server Edition	NVIDIA RTX PRO 6000 Blackwell Server Edition	bf943eafe00cb566171d0e7f7638a82f0f0858d6
exp1	Decrease TOTAL_BATCH_SIZE from default to 32768 to increase gradient steps	0.000000	0.0	0	0.0	0	crash	training crashed or timed out	NVIDIA RTX PRO 6000 Blackwell Server Edition	bf943eafe00cb566171d0e7f7638a82f0f0858d6
exp2	Decrease DEVICE_BATCH_SIZE from default to 512 to increase gradient steps	0.000000	0.0	0	0.0	0	crash	training crashed or timed out	NVIDIA RTX PRO 6000 Blackwell Server Edition	bf943eafe00cb566171d0e7f7638a82f0f0858d6
exp3	Decrease TOTAL_BATCH_SIZE from default to 16384 to increase gradient steps	0.000000	0.0	0	0.0	0	crash	training crashed or timed out	NVIDIA RTX PRO 6000 Blackwell Server Edition	bf943eafe00cb566171d0e7f7638a82f0f0858d6
exp4	Increase DEPTH from default to 20 to add model capacity	1.193355	66.9	58882	42.0	270	discard	All batch size reduction experiments have crashed, suggesting memory or configur	NVIDIA RTX PRO 6000 Blackwell Server Edition	bf943eafe00cb566171d0e7f7638a82f0f0858d6
exp5	Decrease EMBEDDING_LR from 0.6 to 0.3 to reduce learning rate instability	1.074584	17.1	253248	28.3	1160	keep	The baseline achieved the best val_bpb so far, but the embedding learning rate o	NVIDIA RTX PRO 6000 Blackwell Server Edition	bf943eafe00cb566171d0e7f7638a82f0f0858d6
exp6	Decrease MATRIX_LR from 0.04 to 0.03 to reduce matrix parameter learning rate instability	1.072397	17.1	253413	28.3	1161	keep	The previous experiment showed that reducing EMBEDDING_LR from 0.6 to 0.3 improv	NVIDIA RTX PRO 6000 Blackwell Server Edition	bf943eafe00cb566171d0e7f7638a82f0f0858d6
